{
  "proxyUrl": "https://github.com",
  "cookieSecret": "cookie secret",
  "sessionMaxAgeHours": 12,
  "configurationSources": {
    "enabled": true,
    "reloadIntervalSeconds": 60,
    "merge": false,
    "sources": [
      {
        "type": "file",
        "enabled": false,
        "path": "./external-config.json"
      },
      {
        "type": "http",
        "enabled": false,
        "url": "http://config-service/git-proxy-config",
        "headers": {},
        "auth": {
          "type": "bearer",
          "token": ""
        }
      },
      {
        "type": "git",
        "enabled": true,
        "repository": "https://gitlab.citadel.red/public-group/git-proxy-config",
        "branch": "main",
        "path": "git-proxy/config.json",
        "auth": {
          "type": "ssh",
          "privateKeyPath": "/Users/dcoric/.ssh/bb_rsa"
        }
      }
    ]
  },
  "tempPassword": {
    "sendEmail": false,
    "emailConfig": {}
  },
  "authorisedList": [],
  "sink": [
    {
      "type": "fs",
      "params": {
        "filepath": "./."
      },
      "enabled": true
    },
    {
      "type": "mongo",
      "connectionString": "mongodb://localhost:27017/gitproxy",
      "options": {
        "useNewUrlParser": true,
        "useUnifiedTopology": true,
        "tlsAllowInvalidCertificates": false,
        "ssl": true
      },
      "enabled": false
    }
  ],
  "authentication": [
    {
      "type": "local",
      "enabled": true
    },
    {
      "type": "ActiveDirectory",
      "enabled": false,
      "adminGroup": "",
      "userGroup": "",
      "domain": "",
      "adConfig": {
        "url": "",
        "baseDN": "",
        "searchBase": ""
      }
    }
  ],
  "api": {
    "github": {
      "baseUrl": "https://api.github.com"
    }
  },
  "commitConfig": {
    "author": {
      "email": {
        "local": {
          "block": ""
        },
        "domain": {
          "allow": ".*"
        }
      }
    },
    "message": {
      "block": {
        "literals": [],
        "patterns": []
      }
    },
    "diff": {
      "block": {
        "literals": [],
        "patterns": [],
        "providers": {}
      }
    }
  },
  "attestationConfig": {
    "questions": [
      {
        "label": "I am happy for this to be pushed to the upstream repository",
        "tooltip": {
          "text": "Are you happy for this contribution to be pushed upstream?",
          "links": []
        }
      }
    ]
  },
  "domains": {},
  "privateOrganizations": [],
  "urlShortener": "",
  "contactEmail": "",
  "csrfProtection": true,
  "plugins": []
}
